{
  "schemaVersion": "5.0",
  "fileKind": "diagnostic-report",
  "reportDescriptor": {
    "reportId": "rpt-false-success-GPT-e5bea531",
    "reportType": "false-success",
    "reportVersion": "2.3.0",
    "title": "Почему система решила «готово», а ответ продолжил расти?",
    "primaryQuestion": "Почему система решила «готово», а ответ продолжил расти?",
    "applicability": {
      "status": "confirmed",
      "mode": "all",
      "predicateResults": [
        {
          "predicate": {
            "path": "$.derivedViews.terminalOutcome",
            "operator": "eq",
            "value": "SUCCESS"
          },
          "observedValue": "SUCCESS",
          "known": true,
          "matched": true
        },
        {
          "predicate": {
            "path": "$.derivedViews.postTerminalAuditStatus",
            "operator": "eq",
            "value": "completed"
          },
          "observedValue": "completed",
          "known": true,
          "matched": true
        },
        {
          "predicate": {
            "path": "$.derivedViews.postTerminalGrowthProven",
            "operator": "eq",
            "value": true
          },
          "observedValue": true,
          "known": true,
          "matched": true
        }
      ]
    },
    "diagnosisArbitration": {
      "primaryDiagnosis": "false-success",
      "confirmedDiagnoses": [
        "false-success"
      ],
      "explanationRole": "primary",
      "causedBy": null
    },
    "canDiagnose": [
      {
        "claim": "all required evidence slots are materialized"
      }
    ],
    "cannotDiagnoseAlone": [],
    "completeness": {
      "level": "complete",
      "evidenceCoveragePct": 100,
      "missingCriticalEvidence": false,
      "missingItems": [],
      "safeConclusions": [
        "all required evidence slots are materialized"
      ],
      "blockedConclusions": []
    },
    "reportMode": "standalone",
    "dependencyRegistryVersion": "5.1.0",
    "dependencyRegistryHash": "sha256:537ecb83ba679af14fc6c4cd1d36c9ebad9a9171f3e27c1b54452f7c0c64b3dd",
    "limitations": []
  },
  "correlation": {
    "incidentId": "incident:synthetic-run|1|GPT|synthetic-dispatch|1",
    "runSessionId": "synthetic-run",
    "runGeneration": 1,
    "modelId": "GPT",
    "dispatchId": "synthetic-dispatch",
    "generationEpoch": 1,
    "candidateIds": [],
    "navigationLineage": [],
    "selectionReason": "task_evidence_rank_then_latest_including_zero_match",
    "matchingIncidentCount": 1,
    "otherMatchingIncidents": []
  },
  "reportCatalogSnapshot": [
    {
      "reportType": "cutted",
      "reportVersion": "2.3.0",
      "included": false
    },
    {
      "reportType": "false-success",
      "reportVersion": "2.3.0",
      "included": true
    },
    {
      "reportType": "old-answer",
      "reportVersion": "2.3.0",
      "included": false
    },
    {
      "reportType": "empty",
      "reportVersion": "2.3.0",
      "included": false
    },
    {
      "reportType": "prompt-not-inserted",
      "reportVersion": "2.3.0",
      "included": false
    },
    {
      "reportType": "prompt-not-sent",
      "reportVersion": "2.3.0",
      "included": false
    },
    {
      "reportType": "late-end",
      "reportVersion": "2.3.0",
      "included": false
    }
  ],
  "runConfiguration": {
    "extensionVersion": "2.81.151",
    "policy": {
      "automaticMinimumEvidenceTier": 3,
      "thresholds": {
        "generationStartTimeoutMs": 15000,
        "minimumExtractionCoveragePct": 98,
        "postTerminalGrowthTolerancePct": 0.5,
        "automaticMinimumEvidenceTier": 3,
        "maximumSignalSkewMs": 250
      }
    },
    "privacy": {
      "mode": "metadata-only"
    }
  },
  "diagnosticSummary": {
    "incidentId": "incident:synthetic-run|1|GPT|synthetic-dispatch|1",
    "applicability": {
      "status": "confirmed",
      "mode": "all",
      "predicateResults": [
        {
          "predicate": {
            "path": "$.derivedViews.terminalOutcome",
            "operator": "eq",
            "value": "SUCCESS"
          },
          "observedValue": "SUCCESS",
          "known": true,
          "matched": true
        },
        {
          "predicate": {
            "path": "$.derivedViews.postTerminalAuditStatus",
            "operator": "eq",
            "value": "completed"
          },
          "observedValue": "completed",
          "known": true,
          "matched": true
        },
        {
          "predicate": {
            "path": "$.derivedViews.postTerminalGrowthProven",
            "operator": "eq",
            "value": true
          },
          "observedValue": true,
          "known": true,
          "matched": true
        }
      ]
    },
    "sufficiency": "complete",
    "evidenceSlots": [
      {
        "slotId": "success_terminal",
        "criticality": "critical",
        "effectiveCriticality": "critical",
        "requiredIf": null,
        "requiredIfMatched": false,
        "acceptedEventTypes": [
          "MODEL_TERMINAL_RECORDED"
        ],
        "status": "satisfied",
        "eventIds": [
          "event-23a4e34a-d1884fd6"
        ],
        "matchedEventCount": 1,
        "selectedEventCount": 1,
        "impact": null
      },
      {
        "slotId": "post_terminal_audit",
        "criticality": "critical",
        "effectiveCriticality": "critical",
        "requiredIf": null,
        "requiredIfMatched": false,
        "acceptedEventTypes": [
          "POST_TERMINAL_AUDIT_COMPLETED"
        ],
        "status": "satisfied",
        "eventIds": [
          "event-f87dbed2-1694942a"
        ],
        "matchedEventCount": 1,
        "selectedEventCount": 1,
        "impact": null
      },
      {
        "slotId": "terminal_decision",
        "criticality": "required",
        "effectiveCriticality": "required",
        "requiredIf": null,
        "requiredIfMatched": false,
        "acceptedEventTypes": [
          "DECISION_RECORDED"
        ],
        "status": "satisfied",
        "eventIds": [
          "event-1c13ba5b-9cfe4fbb"
        ],
        "matchedEventCount": 1,
        "selectedEventCount": 1,
        "impact": null
      },
      {
        "slotId": "generation_state",
        "criticality": "required",
        "effectiveCriticality": "required",
        "requiredIf": null,
        "requiredIfMatched": false,
        "acceptedEventTypes": [
          "GENERATION_SIGNAL_CHANGED",
          "OBSERVATION_FRAME_CAPTURED"
        ],
        "status": "satisfied",
        "eventIds": [
          "event-04405770-82fc6190"
        ],
        "matchedEventCount": 1,
        "selectedEventCount": 1,
        "impact": null
      },
      {
        "slotId": "post_terminal_mutation",
        "criticality": "required",
        "effectiveCriticality": "required",
        "requiredIf": null,
        "requiredIfMatched": false,
        "acceptedEventTypes": [
          "TEXT_STATE_CHANGED"
        ],
        "status": "satisfied",
        "eventIds": [
          "event-8ee81501-33e83581"
        ],
        "matchedEventCount": 1,
        "selectedEventCount": 1,
        "impact": null
      },
      {
        "slotId": "completion_proof",
        "criticality": "conditional",
        "effectiveCriticality": "conditional",
        "requiredIf": {
          "path": "$.stateAxes.terminalMode",
          "operator": "eq",
          "value": "automatic"
        },
        "requiredIfMatched": false,
        "acceptedEventTypes": [
          "COMPLETION_HYPOTHESIS_EVALUATED",
          "ANSWER_COMPLETENESS_EVALUATED"
        ],
        "status": "satisfied",
        "eventIds": [
          "event-0fdd4ea6-042a4e12"
        ],
        "matchedEventCount": 1,
        "selectedEventCount": 1,
        "impact": null
      },
      {
        "slotId": "finalization_policy",
        "criticality": "conditional",
        "effectiveCriticality": "required",
        "requiredIf": {
          "path": "$.stateAxes.terminalMode",
          "operator": "in",
          "value": [
            "forced",
            "recovery"
          ]
        },
        "requiredIfMatched": true,
        "acceptedEventTypes": [
          "TERMINAL_DEADLINE_REACHED",
          "FINALIZATION_POLICY_EVALUATED",
          "POLICY_OVERRIDE_APPLIED"
        ],
        "status": "satisfied",
        "eventIds": [
          "event-484f7778-03da40e8"
        ],
        "matchedEventCount": 1,
        "selectedEventCount": 1,
        "impact": null
      },
      {
        "slotId": "missing_evidence",
        "criticality": "conditional",
        "effectiveCriticality": "conditional",
        "requiredIf": null,
        "requiredIfMatched": false,
        "acceptedEventTypes": [
          "MISSING_EVIDENCE_RECORDED"
        ],
        "status": "satisfied",
        "eventIds": [
          "event-13323da5-09b05bc1"
        ],
        "matchedEventCount": 1,
        "selectedEventCount": 1,
        "impact": null
      }
    ],
    "safeConclusions": [
      "all required evidence slots are materialized"
    ],
    "blockedConclusions": []
  },
  "stateAxes": {
    "submission": "not_attempted",
    "generationStart": "not_evaluated",
    "answerIdentity": "none",
    "observedGeneration": "inactive",
    "textEvolution": "none",
    "answerCompleteness": "unknown",
    "extraction": "none",
    "verification": "none",
    "completionDetection": "inconclusive",
    "completionEvidenceTier": 1,
    "observationReliability": "unknown",
    "finalization": "accepted",
    "terminalMode": "forced",
    "terminationCause": "policy_forced"
  },
  "eventSelection": {
    "includedEventTypes": [
      "MODEL_TERMINAL_RECORDED",
      "POST_TERMINAL_AUDIT_COMPLETED",
      "DECISION_RECORDED",
      "GENERATION_SIGNAL_CHANGED",
      "TEXT_STATE_CHANGED",
      "COMPLETION_HYPOTHESIS_EVALUATED",
      "TERMINAL_DEADLINE_REACHED",
      "MISSING_EVIDENCE_RECORDED"
    ],
    "eventRefs": [
      "event-23a4e34a-d1884fd6",